<!ELEMENT motion_class (motion_class*, motion_object*)>
<!ELEMENT motion_object (#PCDATA)>

<!ATTLIST motion_class
        name CDATA #IMPLIED
        cyclic CDATA #IMPLIED
        inOrder CDATA #IMPLIED>
<!ATTLIST motion_object
        name CDATA #REQUIRED
        length CDATA #REQUIRED
        path CDATA #REQUIRED>